{
  "id": "ai-only-anthropic",
  "mode": "ai_only",
  "migration_id": "ai-only-anthropic",
  "run_id": "00000000-0000-4000-8000-000000000013",
  "state": ".phase-status.json",
  "dimensions": {
    "infrastructure_source": null,
    "ai_sources": [{"provider": "anthropic", "source_service": "anthropic_api", "model_families": ["claude"], "model_evidence": "observed", "models": ["claude-3-5-sonnet-20240620"]}],
    "gateways": []
  },
  "outcomes": {
    "infrastructure": null,
    "ai": {"verdict": "passed", "artifacts": ["ai-workload-profile.json", "aws-design-ai.json", "estimation-ai.json", "generation-ai.json"]},
    "integration_validation": null
  }
}
